{
  "schema_version": 1,
  "calib_run_id": "C50",
  "run_id": "20260806-003615-e525",
  "status": "failed",
  "execution_mode": "cli",
  "started_at": "2026-08-06T00:36:15.162714+00:00",
  "finished_at": "2026-08-06T00:36:34.882070+00:00",
  "framework_commit": "19ece8597d35504a2025a82c6db77f34a8f87a09",
  "tdm": {
    "requested_ref": "calib/C50-start",
    "resolved_commit": "33cbf06b1102e7718d838c3a134960b6848e1da6",
    "resolved_tag": "calib/C50-start",
    "branch": null,
    "detached_head": true,
    "dirty": false
  },
  "control_center": {
    "baseline_file": "_ControlCenter-Calib - BY_2023.block",
    "overrides": {
      "CalibrationCode": "C50",
      "Run_Documentation": 0
    },
    "rendered_path": "M:\\GitHub\\WF-TDM-Calibration\\tdm\\Scenarios\\C50\\_ControlCenter.block",
    "driver_script": "Scenarios/_default/__HailMary.s"
  },
  "scenario_folder": "M:\\GitHub\\WF-TDM-Calibration\\tdm\\Scenarios\\C50",
  "execution": {
    "command": [
      "cmd.exe",
      "/c",
      "M:\\GitHub\\WF-TDM-Calibration\\bin\\RunModel.bat",
      "M:\\GitHub\\WF-TDM-Calibration\\tdm\\Scenarios\\C50\\_ControlCenter.block",
      "M:\\GitHub\\WF-TDM-Calibration\\tdm\\Scenarios\\C50"
    ],
    "exit_code": 0,
    "log_path": "M:\\GitHub\\WF-TDM-Calibration\\tdm\\Scenarios\\C50\\logs\\orchestrator_invocation.log",
    "status_source": "exit_code"
  },
  "outputs": {
    "inventory_count": 8,
    "inventory_total_bytes": 184256,
    "curated": []
  },
  "error": "No files under M:\\GitHub\\WF-TDM-Calibration\\tdm\\Scenarios\\C50 matched outputs.include [{'datafile': '0_InputProcessing/SE_File.dbf'}, {'datafile': '1_HHDisag_AutoOwn/Joint_HHSize_Income_Worker.dbf'}, {'datafile': '1_HHDisag_AutoOwn/VO_HHSize_VehOwn.dbf'}, {'datafile': '1_HHDisag_AutoOwn/VO_HH1_IncLoHi_Worker_VehOwn.dbf'}, {'datafile': '1_HHDisag_AutoOwn/VO_HH2_IncLoHi_Worker_VehOwn.dbf'}, {'datafile': '1_HHDisag_AutoOwn/VO_HH3_IncLoHi_Worker_VehOwn.dbf'}, {'datafile': '1_HHDisag_AutoOwn/VO_HH4_IncLoHi_Worker_VehOwn.dbf'}, {'datafile': '1_HHDisag_AutoOwn/VO_HH5_IncLoHi_Worker_VehOwn.dbf'}, {'datafile': '1_HHDisag_AutoOwn/VO_HH6_IncLoHi_Worker_VehOwn.dbf'}, {'datafile': '3_Distribute/pa_final.csv'}, {'datafile': '3_Distribute/SumToDistricts/DISTLRG_PA_Gravity_AllPurp.csv'}, {'datafile': '3_Distribute/TLF/TLF_Cost.csv'}, {'datafile': '3_Distribute/TLF/TLF_Dist.csv'}, {'datafile': '3_Distribute/TLF/TLF_Time.csv'}, {'datafile': '4_ModeChoice/5_DistrictSummary/DISTLRG_PA_AllPurp.csv'}, {'datafile': '4_ModeChoice/2_DetailedTripMatrices/IMZ_TripTotals.csv'}, {'datafile': '4_ModeChoice/3_TransitAssign/___*___transit_brding_summary_node.csv'}, {'datafile': '4_ModeChoice/3_TransitAssign/___*___transit_rider_summary_link.csv'}, {'datafile': '4_ModeChoice/4_Shares/___*___RegionShares_Ok.csv'}, {'datafile': '4_ModeChoice/4_Shares/___*___RegionShares_Pk.csv'}, {'datafile': '5_AssignHwy/4_Summaries/___*___Summary_SEGID.csv'}, {'datafile': '5_AssignHwy/4_Summaries/___*___Summary_SEGID_Detailed.csv'}, {'matrix': '3_Distribute/PA_AllPurp_GRAVITY.MTX', 'tabs': ['HBW', 'HBShp', 'HBOth', 'HBSch_Pr', 'HBSch_Sc', 'HBC', 'NHBW', 'NHBNW'], 'format': 'omx'}, {'matrix': '3_Distribute/skm_DY_GC.MTX', 'tabs': ['HBW', 'HBShp', 'HBOth', 'NHBW', 'NHBNW', 'HBS', 'LT', 'MD', 'HV', 'Ext'], 'format': 'omx'}, {'matrix': '3_Distribute/skm_DY_Dist.MTX', 'tabs': ['HBW', 'HBShp', 'HBOth', 'NHBW', 'NHBNW', 'HBS', 'LT', 'MD', 'HV', 'Ext'], 'format': 'omx'}, {'matrix': '5_AssignHwy/5_FinalNetSkims/Skm_AM.MTX', 'tabs': ['GP_Dist', 'GP_IVT'], 'format': 'omx'}, {'matrix': '5_AssignHwy/5_FinalNetSkims/Skm_MD.MTX', 'tabs': ['GP_Dist', 'GP_IVT'], 'format': 'omx'}, {'matrix': '5_AssignHwy/5_FinalNetSkims/Skm_PM.MTX', 'tabs': ['GP_Dist', 'GP_IVT'], 'format': 'omx'}, {'matrix': '5_AssignHwy/5_FinalNetSkims/Skm_EV.MTX', 'tabs': ['GP_Dist', 'GP_IVT'], 'format': 'omx'}, {'matrix': 'Temp/4_ModeChoice/pa_HBW_0veh_hi.MTX', 'tabs': ['trips'], 'format': 'omx'}, {'matrix': 'Temp/4_ModeChoice/pa_HBW_0veh_lo.MTX', 'tabs': ['trips'], 'format': 'omx'}, {'matrix': 'Temp/4_ModeChoice/pa_HBW_1veh_hi.MTX', 'tabs': ['trips'], 'format': 'omx'}, {'matrix': 'Temp/4_ModeChoice/pa_HBW_1veh_lo.MTX', 'tabs': ['trips'], 'format': 'omx'}, {'matrix': 'Temp/4_ModeChoice/pa_HBW_2veh_hi_noXI.MTX', 'tabs': ['trips'], 'format': 'omx'}, {'matrix': 'Temp/4_ModeChoice/pa_HBW_2veh_lo_noXI.MTX', 'tabs': ['trips'], 'format': 'omx'}, {'matrix': '4_ModeChoice/2_DetailedTripMatrices/AllTrips_Pk.MTX', 'tabs': ['wCRT', 'dCRT'], 'format': 'omx'}, {'matrix': '4_ModeChoice/2_DetailedTripMatrices/AllTrips_Ok.MTX', 'tabs': ['wCRT', 'dCRT'], 'format': 'omx'}, {'matrix': '4_ModeChoice/1a_Skims/skm_w8_Pk.MTX', 'tabs': ['D8'], 'format': 'omx'}, {'matrix': '4_ModeChoice/1a_Skims/skm_w8_Ok.MTX', 'tabs': ['D8'], 'format': 'omx'}, {'matrix': '4_ModeChoice/1a_Skims/skm_d8_Pk.MTX', 'tabs': ['D8'], 'format': 'omx'}, {'matrix': '4_ModeChoice/1a_Skims/skm_d8_Ok.MTX', 'tabs': ['D8'], 'format': 'omx'}]."
}
